{
  "schema_version": "1.0",
  "manifest_id": "11111111-1111-4111-8111-111111111111",
  "run_id": "22222222-2222-4222-8222-222222222222",
  "source": {
    "repository": "https://github.com/USS-Parks/BONSAI-Research-Labs",
    "revision": "127b20b68957fb1473fba670fe4cd411187c062e",
    "dirty": false
  },
  "adapter": {
    "component_id": "bonsai-reference-adapter",
    "version": "1.0.0",
    "entrypoint": ["bonsai-reference-adapter", "serve"],
    "config": {"protocol": "stdio"}
  },
  "environment": {
    "component_id": "bonsai-diagnostic-world",
    "version": "1.0.0",
    "entrypoint": ["bonsai-diagnostic-world", "run"],
    "config": {"observation_mode": "tabular"}
  },
  "seeds": [
    {"seed_id": "agent", "value": "17"},
    {"seed_id": "environment", "value": "23"}
  ],
  "track": {
    "declared_track": "A",
    "batch_size": 1,
    "replay": {"enabled": false, "source": "none", "capacity_transitions": 0},
    "offline_updates": false,
    "observer_data_access": false,
    "privileged_inputs": false,
    "human_labels": false
  },
  "resource_profile": {
    "profile_id": "S",
    "step_limit": 2000,
    "wall_time_limit_ns": 120000000000,
    "agent_rss_limit_bytes": 1073741824,
    "agent_storage_limit_bytes": 67108864,
    "observer_output_limit_bytes": 536870912,
    "per_step_cpu_time_limit_ns": 10000000,
    "action_deadline_ns": 50000000,
    "energy_tier": "E0",
    "energy_budget_uj": null
  },
  "metrics": [
    {"metric_id": "behavior.reward", "version": "1.0", "required": true, "parameters": {}}
  ],
  "scenario": {
    "scenario_id": "diagnostic.switching-chain",
    "version": "1.0.0",
    "family": "nonstationary_control",
    "variant": "smoke",
    "reward_unit_id": "scenario_reward",
    "config": {"change_interval_steps": 500}
  },
  "expected_counters": [
    {"counter_id": "process_cpu_time", "unit": "ns", "acceptable_basis": "measured", "required_for_run": true},
    {"counter_id": "agent_rss", "unit": "B", "acceptable_basis": "measured", "required_for_run": true},
    {"counter_id": "environment_steps", "unit": "1", "acceptable_basis": "measured", "required_for_run": true}
  ],
  "publication_eligibility": {"status": "eligible", "reason_codes": []}
}
